{
    "docstring": "",
    "header": [],
    "footer": [],
    "imports": [
        {
            "import_names": [
                {
                    "name": "logging",
                    "as_name": "",
                    "local_block_id": ""
                }
            ],
            "imported_from": "",
            "import_module_type": "STANDARD_LIBRARY",
            "local_module_id": ""
        },
        {
            "import_names": [
                {
                    "name": "Any",
                    "as_name": "",
                    "local_block_id": ""
                }
            ],
            "imported_from": "typing",
            "import_module_type": "STANDARD_LIBRARY",
            "local_module_id": ""
        },
        {
            "import_names": [
                {
                    "name": "ArangoClient",
                    "as_name": "",
                    "local_block_id": ""
                }
            ],
            "imported_from": "arango.client",
            "import_module_type": "THIRD_PARTY",
            "local_module_id": ""
        },
        {
            "import_names": [
                {
                    "name": "StandardDatabase",
                    "as_name": "",
                    "local_block_id": ""
                }
            ],
            "imported_from": "arango.database",
            "import_module_type": "THIRD_PARTY",
            "local_module_id": ""
        },
        {
            "import_names": [
                {
                    "name": "Result",
                    "as_name": "",
                    "local_block_id": ""
                }
            ],
            "imported_from": "arango.result",
            "import_module_type": "THIRD_PARTY",
            "local_module_id": ""
        },
        {
            "import_names": [
                {
                    "name": "Jsons",
                    "as_name": "",
                    "local_block_id": ""
                },
                {
                    "name": "Json",
                    "as_name": "",
                    "local_block_id": ""
                }
            ],
            "imported_from": "arango.typings",
            "import_module_type": "THIRD_PARTY",
            "local_module_id": ""
        },
        {
            "import_names": [
                {
                    "name": "fenec.databases.arangodb.helper_functions",
                    "as_name": "helper_functions",
                    "local_block_id": ""
                }
            ],
            "imported_from": "",
            "import_module_type": "LOCAL",
            "local_module_id": "fenec:databases:arangodb:helper_functions.py__*__MODULE"
        }
    ],
    "id": "fenec:databases:arangodb:arangodb_connector.py__*__MODULE",
    "file_path": "fenec/databases/arangodb/arangodb_connector.py",
    "parent_id": "fenec:databases:arangodb__*__DIRECTORY",
    "block_type": "MODULE",
    "start_line_num": 1,
    "end_line_num": 162,
    "code_content": "import logging\nfrom typing import Any\nfrom arango.client import ArangoClient\nfrom arango.database import StandardDatabase\nfrom arango.result import Result\nfrom arango.typings import Jsons, Json\n\nimport fenec.databases.arangodb.helper_functions as helper_functions\n\n\nclass ArangoDBConnector:\n    \"\"\"\n    A connector class for interacting with ArangoDB to manage collections and ensure proper database setup.\n\n    This class provides methods to connect to an ArangoDB instance, create or ensure the existence of a specified database, collections, and edge collections. It also supports deletion of all user-defined collections within the database.\n\n    Attributes:\n        - client (ArangoClient): The ArangoDB client instance.\n        - username (str): The username used for authentication.\n        - password (str): The password used for authentication.\n        - db_name (str): The name of the ArangoDB database.\n\n    Example:\n        ```python\n        # This example demonstrates how to use ArangoDBConnector to connect to an ArangoDB instance and ensure collections.\n        connector = ArangoDBConnector(url=\"http://localhost:8529\", username=\"root\", password=\"openSesame\", db_name=\"fenec\")\n        connector.ensure_collections()\n        ```\n\n    Methods:\n        - ensure_collections(): Ensures the existence of required collections and edge collections.\n        - ensure_collection(collection_name, schema=None): Ensures the existence of a collection with an optional specified schema.\n        - ensure_edge_collection(collection_name): Ensures the existence of an edge collection.\n        - delete_all_collections(): Deletes all user-defined collections within the ArangoDB database.\n    \"\"\"\n\n    def __init__(\n        self,\n        url: str = \"http://localhost:8529\",\n        username: str = \"root\",\n        password: str = \"openSesame\",\n        db_name: str = \"fenec\",\n    ) -> None:\n        self.client = ArangoClient(hosts=url)\n        self.username: str = username\n        self.password: str = password\n        self.db_name: str = db_name\n        self.db: StandardDatabase = self._ensure_database()\n\n    def _ensure_database(self) -> StandardDatabase:\n        \"\"\"\n        Ensures the existence of the specified database, creating it if necessary.\n\n        Returns:\n            StandardDatabase: The ArangoDB database instance.\n        \"\"\"\n\n        sys_db: StandardDatabase = self.client.db(\n            \"_system\", username=self.username, password=self.password\n        )\n        if not sys_db.has_database(self.db_name):\n            sys_db.create_database(self.db_name)\n        return self.client.db(\n            self.db_name, username=self.username, password=self.password\n        )\n\n    # def _ensure_vertex_collections(self, vertex_collections: list[str]) -> None:\n    #     for collection in vertex_collections:\n    #         if not self.db.has_collection(collection):\n    #             self.db.create_collection(collection)\n\n    def _get_current_schema(self, collection_name: str) -> dict:\n        \"\"\"\n        Retrieves the current schema of a collection.\n\n        Args:\n            - collection_name (str): The name of the collection.\n\n        Returns:\n            dict: The current schema of the collection.\n        \"\"\"\n\n        collection = self.db.collection(collection_name)\n        try:\n            properties: Result[Json] = collection.properties()\n            return properties.get(\"schema\", {})  # type: ignore # FIXME: Fix type error\n        except Exception as e:\n            logging.error(f\"Error retrieving current schema for {collection_name}: {e}\")\n            return {}\n\n    def ensure_collection(\n        self, collection_name: str, schema: dict[str, Any] | None = None\n    ) -> None:\n        \"\"\"\n        Ensures the existence of a collection with an optional specified schema.\n\n        Args:\n            - collection_name (str): The name of the collection.\n            - schema (dict[str, Any], optional): The schema to be applied to the collection. Defaults to None.\n        \"\"\"\n\n        if not self.db.has_collection(collection_name) and not schema:\n            self.db.create_collection(collection_name)\n            logging.info(f\"Created collection: {collection_name}\")\n        # else:\n        #     current_schema = self._get_current_schema(collection_name)\n        #     self.db.collection(collection_name)\n        # if current_schema != schema:\n        #     collection = self.db.collection(collection_name)\n        #     try:\n        #         collection.configure(schema=schema)\n        #         logging.info(f\"Updated schema for collection: {collection_name}\")\n        #     except Exception as e:\n        #         logging.error(f\"Error updating schema for {collection_name}: {e}\")\n\n    def ensure_edge_collection(self, collection_name: str) -> None:\n        \"\"\"\n        Ensures the existence of an edge collection.\n\n        Args:\n            - collection_name (str): The name of the edge collection.\n        \"\"\"\n\n        if not self.db.has_collection(collection_name):\n            self.db.create_collection(collection_name, edge=True)\n            logging.info(f\"Created edge collection: {collection_name}\")\n\n    def delete_all_collections(self) -> None:\n        \"\"\"Deletes all user-defined collections within the ArangoDB database.\"\"\"\n        collections: Result[Jsons] = self.db.collections()\n\n        for collection in collections:  # type: ignore # FIXME: Fix type error\n            if not collection[\"name\"].startswith(\"_\"):  # Skip system collections\n                self.db.delete_collection(collection[\"name\"])\n                logging.info(f\"Deleted collection: {collection['name']}\")\n\n    def ensure_collections(self) -> None:\n        \"\"\"\n        Ensures the existence of required collections and edge collections.\n\n        This includes creating collections for modules, classes, functions, standalone code blocks, and the \"code_edges\" edge collection.\n        \"\"\"\n        # model_schemas: dict[str, dict[str, Any]] = self._get_model_schemas()\n        required_collections: list[str] = (\n            helper_functions.pluralized_and_lowered_block_types()\n        )\n\n        for collection_name in required_collections:\n            # schema: dict[str, Any] = model_schemas[collection_name]\n            # self.ensure_collection(collection_name, schema)\n            self.ensure_collection(collection_name)\n\n        self.ensure_edge_collection(\"code_edges\")\n\n    # def _get_model_schemas(self) -> dict[str, dict[str, Any]]:\n    #     return {\n    #         \"modules\": ModuleModel.model_json_schema(),\n    #         \"classes\": ClassModel.model_json_schema(),\n    #         \"functions\": FunctionModel.model_json_schema(),\n    #         \"standalone_blocks\": StandaloneCodeBlockModel.model_json_schema(),\n    #     }\n",
    "important_comments": [],
    "dependencies": [],
    "summary": "The `ArangoDBConnector` class is a Python utility designed to streamline interactions with an ArangoDB database, focusing on the management and setup of collections and databases. Its primary purpose is to automate the connection to an ArangoDB instance, verify and create specified databases, and manage user-defined collections, including their creation, schema application, and deletion. This functionality is crucial for applications that rely on ArangoDB for data storage and retrieval, ensuring that the necessary database structures are in place for smooth operation.\n\nKey components of the `ArangoDBConnector` class include: the `__init__` method, which initializes the connection to the database using the ArangoDB client and sets up the database; `_ensure_database`, which checks for the existence of the specified database and creates it if necessary; `ensure_collection`, which ensures a collection's existence and optionally applies a schema; `ensure_edge_collection`, which manages edge collections; `delete_all_collections`, which removes all user-defined collections; and `ensure_collections`, which sets up necessary collections and edge collections based on predefined requirements. The `_get_current_schema` method is intended to retrieve the current schema of a collection, although its implementation is incomplete, indicating ongoing development.\n\nThe implementation leverages the ArangoDB Python client to interact with the database, utilizing methods such as `has_database`, `create_database`, and `has_collection` to manage database and collection existence. The design pattern follows a typical database connector structure, encapsulating specific database operations within methods. The code includes commented-out sections for schema management and collection verification, suggesting potential future enhancements for schema validation and dynamic collection setup. The use of helper functions from `fenec.databases.arangodb.helper_functions`, such as `pluralized_and_lowered_block_types`, indicates a modular approach, where additional logic for collection management is abstracted into separate utility functions, enhancing code maintainability and readability.\n\nThe technical stack primarily includes the `arango` library, which provides the necessary tools for interacting with ArangoDB, handling database connections, and performing operations on collections. The code also utilizes Python's `logging` module for potential logging purposes, although explicit logging statements are not present in the provided snippet. The use of type hints and the `typing` module indicates a focus on type safety and code clarity.\n\nIn the context of a larger system, this code serves as a backend utility for database management, ensuring that the necessary collections and schemas are in place for applications relying on ArangoDB. It interacts with other components by providing a reliable interface for database operations, supporting the broader data management and persistence needs of the system. The commented-out sections and placeholder comments suggest that the code is part of an evolving codebase, with potential for further enhancements and integration with other modules, such as model schema management and more sophisticated collection handling. This connector is likely a critical component in a data-driven application, ensuring that the database layer is robust and adaptable to the application's requirements.",
    "children_ids": [
        "fenec:databases:arangodb:arangodb_connector.py__*__MODULE__*__CLASS-ArangoDBConnector"
    ]
}